{
  "dataset_sha256": "3b05177b805bc0a8d4200e3adeabfb0c5eed4c320488ef646857877e77fb3768",
  "fixture_sha256": "2ac5557eb3d61c5bef3f358afd1535206600e19f23bfb9365196934c5abfa5f0",
  "model_id": "SMOKE_ORACLE_REPLAY",
  "model_snapshot": "not-a-model",
  "prompt_sha256": "3c0e467526d3fe04c21fb02cd3d2c8e29fc4441924c8e8d42fd015786fdd5fb0",
  "rag_index_sha256": "2dd1bcf7b22e654e8c0924b24240a5988453d70cc8bcce1c2a768e955bfee748",
  "result_files": {
    "V0": "a60a797475f6773da5a2d2b25ebf5eae343c59398dbdd1c7e6ddd11a01dadf60",
    "V1": "4aa049e10f760040dddf2496359a4af06d2032e0443ec76141e1dd74123a137d",
    "V2": "503f6887a178794729c94c6acd6d8763b399a3b10eb5435c25b17099100ebb8d",
    "V3": "c932e22f596c42bf4d174c33c0c8e971c1eff813510b4602f4bf9d2dd8762884",
    "V4": "d24d6316303b1bee8d0e831cb7eb21eec79c9a750c8de19f9cbd78130dcea21c"
  },
  "result_schema_sha256": "bf8cf845e236bf931607d8271c737a33de589428de6e0e82445bf7b087b1c02a",
  "retry_policy_sha256": "d34943d0a1fc2c9a6bf062a0685f9c85ca649359f2fb20e3a098cdb7332f2bdb",
  "run_id": "smoke-oracle-replay-v1",
  "run_mode": "smoke_replay",
  "security_policy_sha256": "b588b5a162ef16c935fcf1c8a83ce41e8283e94eae626aa6ae16224e4d62c99d",
  "versions_config_sha256": "86f2559829e39dfb71415da67f8c434cb1a62a445a56f7520a47a14ed1c586a0"
}
